<?xml version="1.0" encoding="euc-kr"?>
<booklist  xmlns:xsi="http://www.w3.org/2001/XMLSchema-instance"
		       xsi:noNamespaceSchemaLocation="c6_1202.xsd">

	<book>
		<title>XML Programming</title>
		<author>╫е╧нц╤</author>
	</book>

	<book>
		<title>DB Programming</title>
		<writer>ц╓╠теб</writer>
	</book>

	<book>
		<title>JDBC Programming</title>
		<author>╫е╧нц╤</author>
		<author>ц╓╠теб</author>
	</book>

</booklist>